Date,Title,Description,Banner,Article Link,Author,Content
23 Nov 2021,Why Facebook and Twitter are under fire in Ethiopia,Critics say social media firms are not doing enough to curb online hate speech around Ethiopia's war.,https://static.files.bbci.co.uk/bbcdotcom/web/20260609-143108-fe43574f32-web-3.9.0-5/grey-placeholder.png,https://www.bbc.com/news/59251942,23 November 2021ShareSaveAdd as preferred on GooglePeter MwaiBBC Reality Check,Social media giants Facebook and Twitter have come under fire over their roles in the ongoing conflict in Ethiopia. Critics say they are not doing eno...
21 Nov 2021,Mass arrests and ethnic profiling haunt Ethiopia,"As rebel forces advance towards the capital, at least 1,000 ethnic Tigrayans have been detained.",https://static.files.bbci.co.uk/bbcdotcom/web/20260609-143108-fe43574f32-web-3.9.0-5/grey-placeholder.png,https://www.bbc.com/news/world-africa-59347230,"21 November 2021ShareSaveAdd as preferred on GoogleAndrew HardingAfrica correspondent, BBC News",The arrest of two prominent professors in Ethiopia's capital has given new focus to allegations that the authorities are engaged in a ruthless crackdo...
18 Nov 2021,US secretary of state on crises in Sudan and Ethiopia,"The US Secretary of State, Antony Blinken, says there's a real risk of Ethiopia pulling apart if a diplomatic solution isn’t found.",https://static.files.bbci.co.uk/bbcdotcom/web/20260609-143108-fe43574f32-web-3.9.0-5/grey-placeholder.png,https://www.bbc.com/news/world-africa-59341172,Unknown,No content found
18 Nov 2021,How Ethiopia's once mighty army has been outflanked,Ethiopia's army used to be one of the strongest in Africa so how have rebels made such rapid gains?,https://static.files.bbci.co.uk/bbcdotcom/web/20260609-143108-fe43574f32-web-3.9.0-5/grey-placeholder.png,https://www.bbc.com/news/world-africa-59288744,18 November 2021ShareSaveAdd as preferred on GoogleFarouk ChothiaBBC News,"Once a formidable force that commanded the respect of the US, the Ethiopian army has suffered such heavy losses on the front lines that the government..."
15 Nov 2021,Why the Ethiopia conflict matters to the world,The stability of the Horn of Africa in part rests on a peaceful resolution to Ethiopia's civil war.,https://static.files.bbci.co.uk/bbcdotcom/web/20260609-143108-fe43574f32-web-3.9.0-5/grey-placeholder.png,https://www.bbc.com/news/world-africa-59227672,15 November 2021ShareSaveAdd as preferred on Google,"US Secretary of State Antony Blinken is travelling to Kenya, where he will be discussing the conflict in neighbouring Ethiopia. US and UK citizens hav..."
12 Nov 2021,US fears regional impact of Ethiopia conflict,"The US military has a large base in Djibouti, which is monitoring the crisis in neighbouring Ethiopia.",https://static.files.bbci.co.uk/bbcdotcom/web/20260609-143108-fe43574f32-web-3.9.0-5/grey-placeholder.png,https://www.bbc.com/news/world-africa-59265578,Unknown,No content found
10 Nov 2021,Dozens of aid drivers arrested in Ethiopia - UN,The UN is struggling to deliver aid to millions of people in the war-torn north.,https://static.files.bbci.co.uk/bbcdotcom/web/20260609-143108-fe43574f32-web-3.9.0-5/grey-placeholder.png,https://www.bbc.com/news/world-africa-59233516,10 November 2021ShareSaveAdd as preferred on Google,The United Nations says that 72 drivers contracted to deliver humanitarian aid have been arrested in the war-torn north of Ethiopia. It said that the ...
9 Nov 2021,Britons urged to leave Ethiopia amid conflict fear,The UK Government's warning comes amid rising tensions between the Ethiopian government and rebels.,https://static.files.bbci.co.uk/bbcdotcom/web/20260609-143108-fe43574f32-web-3.9.0-5/grey-placeholder.png,https://www.bbc.com/news/uk-59227117,9 November 2021ShareSaveAdd as preferred on Google,British nationals have been urged to leave Ethiopia amid fears a conflict there is worsening. The UK Government is also advising against all travel to...
7 Nov 2021,In pictures: Mass pro-government rally in Ethiopia,The rally comes as rebel Tigrayan forces advance within 300km of the capital Addis Ababa.,https://static.files.bbci.co.uk/bbcdotcom/web/20260609-143108-fe43574f32-web-3.9.0-5/grey-placeholder.png,https://www.bbc.com/news/world-africa-59196465,7 November 2021ShareSaveAdd as preferred on Google,Tens of thousands of people took part in mass rallies in the Ethiopian capital Addis Ababa on Sunday to show support for the government in its fight a...
5 Nov 2021,Ethiopia urges ex-soldiers to fight against rebels,"The army calls on former military personnel to join it, as rebel forces advance on the capital.",https://static.files.bbci.co.uk/bbcdotcom/web/20260609-143108-fe43574f32-web-3.9.0-5/grey-placeholder.png,https://www.bbc.com/news/world-africa-59175404,5 November 2021ShareSaveAdd as preferred on Google,"Ethiopia's military has called on former soldiers to re-join the army, as it battles to hold off a rebel advance. The appeal comes as rebel forces - s..."
4 Nov 2021,How Ethiopia's war is hampering humanitarian efforts,Ongoing fighting across several states in Ethiopia is hampering humanitarian efforts.,https://static.files.bbci.co.uk/bbcdotcom/web/20260609-143108-fe43574f32-web-3.9.0-5/grey-placeholder.png,https://www.bbc.com/news/world-africa-59160862,Unknown,No content found
4 Nov 2021,"A year on, why is Ethiopia still at war?","Here are three reasons why Ethiopia is still at war, a year since the conflict began in the northern region of Tigray.",https://static.files.bbci.co.uk/bbcdotcom/web/20260609-143108-fe43574f32-web-3.9.0-5/grey-placeholder.png,https://www.bbc.com/news/world-africa-59164775,Unknown,No content found
4 Nov 2021,How to end Ethiopia's suffering after a year of war,"Rebels advance towards the capital, while Prime Minister Abiy Ahmed vows to ""bury his enemies"".",https://static.files.bbci.co.uk/bbcdotcom/web/20260609-143108-fe43574f32-web-3.9.0-5/grey-placeholder.png,https://www.bbc.com/news/world-africa-59151370,4 November 2021ShareSaveAdd as preferred on GoogleCatherine Byaruhanga & Yemane NagishBBC News & BBC Tigrinya,"Tigray's rebel forces currently have the upper hand in the war that erupted a year ago in northern Ethiopia. Prime Minister Abiy Ahmed, who fell out w..."
3 Nov 2021,Facebook says Ethiopian PM's post incited violence,"The social giant deletes Abiy Ahmed's post which urged citizens to ""bury"" a rebel group.",https://static.files.bbci.co.uk/bbcdotcom/web/20260609-143108-fe43574f32-web-3.9.0-5/grey-placeholder.png,https://www.bbc.com/news/world-africa-59154984,3 November 2021ShareSaveAdd as preferred on Google,"Facebook has removed a post from Ethiopia's prime minister for violating its policies against inciting violence. On Sunday, Abiy Ahmed called on citiz..."
3 Nov 2021,War crimes possibly committed in Ethiopia - report,"Extra-judicial executions, torture and rape were documented in the Tigray conflict, a new report says.",https://static.files.bbci.co.uk/bbcdotcom/web/20260609-143108-fe43574f32-web-3.9.0-5/grey-placeholder.png,https://www.bbc.com/news/world-africa-59143627,3 November 2021ShareSaveAdd as preferred on Google,"All sides in Ethiopia's Tigray conflict have violated international human rights, some of which may amount to crimes against humanity, a new report st..."
2 Nov 2021,Citizens urged to defend Ethiopia's capital,Addis Ababa residents are told to register weapons and protect areas as rebels advance.,https://static.files.bbci.co.uk/bbcdotcom/web/20260609-143108-fe43574f32-web-3.9.0-5/grey-placeholder.png,https://www.bbc.com/news/world-africa-59134431,2 November 2021ShareSaveAdd as preferred on Google,Officials in Ethiopia's capital Addis Ababa have called on residents to register their weapons and get ready to protect their neighbourhoods amid fear...
1 Nov 2021,Ethiopia's secretive armed group,The BBC's Catherine Byaruhanga gains special access to Ethiopia's Oromo Liberation Army.,https://static.files.bbci.co.uk/bbcdotcom/web/20260609-143108-fe43574f32-web-3.9.0-5/grey-placeholder.png,https://www.bbc.com/news/world-africa-59095778,Unknown,No content found
1 Nov 2021,Ethiopia PM calls on citizens to take up arms,"Abiy Ahmed says advancing Tigray People's Liberation Front are ""pushing the country to its demise.""",https://static.files.bbci.co.uk/bbcdotcom/web/20260609-143108-fe43574f32-web-3.9.0-5/grey-placeholder.png,https://www.bbc.com/news/world-africa-59118773,1 November 2021ShareSaveAdd as preferred on Google,"Ethiopia's Prime Minister, Abiy Ahmed, has appealed to citizens to take up arms to block advancing rebel fighters. He made the call on Facebook after ..."
31 Oct 2021,‘As a child I saw the plane crash that killed my sisters',Harriet was waving her sisters off when the plane left the runway and burned. Now she's finding others linked to the tragedy.,https://static.files.bbci.co.uk/bbcdotcom/web/20260609-143108-fe43574f32-web-3.9.0-5/grey-placeholder.png,https://www.bbc.com/news/stories-59064579,31 October 2021ShareSaveAdd as preferred on GoogleSarah McDermottBBC News,When Harriet Ware-Austin was eight she witnessed a plane accident in which her two older sisters died. She has spent much of the last 49 years in what...
29 Oct 2021,What is Ethiopia's problem with imported wheat?,"Ethiopia has been increasing its wheat production, but this is yet to catch up with growing wheat demand.",https://static.files.bbci.co.uk/bbcdotcom/web/20260609-143108-fe43574f32-web-3.9.0-5/grey-placeholder.png,https://www.bbc.com/news/59048827,29 October 2021ShareSaveAdd as preferred on GooglePeter MwaiBBC Reality Check,"Ethiopia's Prime Minister Abiy Ahmed has claimed that most of the country's problems, including the importing of diseases, stem from foreign wheat aid..."
25 Oct 2021,How the West has fallen out with Ethiopia,The EU and US threaten punitive action against the government and rebels as conflict escalates.,https://static.files.bbci.co.uk/bbcdotcom/web/20260609-143108-fe43574f32-web-3.9.0-5/grey-placeholder.png,https://www.bbc.com/news/world-africa-58967302,25 October 2021ShareSaveAdd as preferred on GoogleFarouk ChothiaBBC News,"With the Ethiopian government's relationship with the US and European Union (EU) at a low ebb, it is looking elsewhere for new allies to crush the reb..."
18 Oct 2021,Ethiopian government admits Tigray airstrike,Officials had earlier denied the government was behind allegedly deadly attacks in the region.,https://static.files.bbci.co.uk/bbcdotcom/web/20260609-143108-fe43574f32-web-3.9.0-5/grey-placeholder.png,https://www.bbc.com/news/world-africa-58958022,18 October 2021ShareSaveAdd as preferred on Google,Ethiopia has admitted it was behind airstrikes in the capital of the conflict-riven Tigray region - hours after it denied it had carried out what rebe...
16 Oct 2021,"Why Tigray is starving, but no famine declared","Despite mass starvation in northern Ethiopia, aid officials are not calling the situation a famine.",https://static.files.bbci.co.uk/bbcdotcom/web/20260609-143108-fe43574f32-web-3.9.0-5/grey-placeholder.png,https://www.bbc.com/news/world-africa-58921744,16 October 2021ShareSaveAdd as preferred on GoogleAlex de WaalAfrica analyst,"Despite mass starvation occurring in Ethiopia's northern region of Tigray, senior international aid officials are tiptoeing around declaring a famine ..."
13 Oct 2021,How the search for Eleni brought three strangers together,"When the Beirut blast destroyed a tower block many were missing, including an Ethiopian woman who lived there.",https://static.files.bbci.co.uk/bbcdotcom/web/20260609-143108-fe43574f32-web-3.9.0-5/grey-placeholder.png,https://www.bbc.com/news/world-africa-58890952,Unknown,No content found
11 Oct 2021,Ethiopian troops launch all-out assault - rebels,"Artillery, tanks, jets and drones are being used to reinvade the Tigray region, rebel forces say.",https://static.files.bbci.co.uk/bbcdotcom/web/20260609-143108-fe43574f32-web-3.9.0-5/grey-placeholder.png,https://www.bbc.com/news/world-africa-58869970,11 October 2021ShareSaveAdd as preferred on Google,"The Ethiopian army has launched co-ordinated attacks on all fronts against forces from the northern Tigray region, the rebels say. They said the gover..."
11 Oct 2021,The Nobel Peace Prize winner who went to war,The Tigray fighting has shattered the overseas reputation of Ethiopia's Prime Minister Abiy Ahmed.,https://static.files.bbci.co.uk/bbcdotcom/web/20260609-143108-fe43574f32-web-3.9.0-5/grey-placeholder.png,https://www.bbc.com/news/world-africa-43567007,11 October 2021ShareSaveAdd as preferred on Google,Ethiopia's Prime Minister Abiy Ahmed was once widely praised outside the country for his reforming zeal but that image was shattered after he launched...
3 Oct 2021,From monk to soldier - how war has split a church,The war in northern Ethiopia has caused deep divisions in the country's largest religious community.,https://static.files.bbci.co.uk/bbcdotcom/web/20260609-143108-fe43574f32-web-3.9.0-5/grey-placeholder.png,https://www.bbc.com/news/world-africa-58742178,3 October 2021ShareSaveAdd as preferred on GoogleFasikaw Menberu & Farouk ChothiaBBC Amharic & BBC News,"An Ethiopian monk, who once carried only the cross and Bible in a land famous for its rock-hewn churches, is now picking up a rifle to march into batt..."
30 Sep 2021,UN shocked by Ethiopia's expulsion of top officials,The expulsions follow concerns raised by the UN about aid reaching the war-torn Tigray region.,https://static.files.bbci.co.uk/bbcdotcom/web/20260609-143108-fe43574f32-web-3.9.0-5/grey-placeholder.png,https://www.bbc.com/news/world-africa-58753569,30 September 2021ShareSaveAdd as preferred on Google,The UN has expressed its shock at the expulsion of seven of its senior officials by the Ethiopian government. Secretary-General António Guterres said ...
27 Sep 2021,"Fire, smoke and colour as Ethiopians mark Meskel",Worshippers gathered to mark the eve of one of the country's biggest Orthodox Christian festivals.,https://static.files.bbci.co.uk/bbcdotcom/web/20260609-143108-fe43574f32-web-3.9.0-5/grey-placeholder.png,https://www.bbc.com/news/world-africa-58706661,27 September 2021ShareSaveAdd as preferred on Google,"Ethiopian Orthodox Christians, celebrating the Meskel festival, came together in the capital, Addis Ababa, after most of the faithful skipped last yea..."
27 Sep 2021,Why are hundreds of aid trucks stuck in Ethiopia?,The UN says hundreds of trucks have not returned from Tigray and it's affecting the flow of aid.,https://static.files.bbci.co.uk/bbcdotcom/web/20260609-143108-fe43574f32-web-3.9.0-5/grey-placeholder.png,https://www.bbc.com/news/58681797,27 September 2021ShareSaveAdd as preferred on GooglePeter MwaiBBC Reality Check,"With concern mounting about the food situation in Ethiopia's Tigray region, there are conflicting claims about why supply trucks are stuck there, unab..."
26 Sep 2021,Sudan says it has repelled Ethiopian troops,Ethiopia denies Sudan's claim of an incursion in the disputed al-Fashaga border region on Saturday.,https://static.files.bbci.co.uk/bbcdotcom/web/20260609-143108-fe43574f32-web-3.9.0-5/grey-placeholder.png,https://www.bbc.com/news/world-africa-58698010,26 September 2021ShareSaveAdd as preferred on Google,"Sudan says it has repelled an attempted ""incursion"" by Ethiopian troops into its territory. The head of the Sudanese military, General Abdel Fattah al..."
19 Sep 2021,The misleading images from Ethiopia’s food crisis,Food shortages are worsening in Ethiopia but some images online are not what they claim to be.,https://static.files.bbci.co.uk/bbcdotcom/web/20260609-143108-fe43574f32-web-3.9.0-5/grey-placeholder.png,https://www.bbc.com/news/58595360,19 September 2021ShareSaveAdd as preferred on GooglePeter MwaiBBC Reality Check,"The spread of conflict from Ethiopia's northern Tigray region into neighbouring Amhara has displaced many thousands of people, leaving many desperatel..."
10 Sep 2021,The country where a year lasts 13 months,Five things you may not know about Ethiopia's unique calendar and cultural heritage.,https://static.files.bbci.co.uk/bbcdotcom/web/20260609-143108-fe43574f32-web-3.9.0-5/grey-placeholder.png,https://www.bbc.com/news/world-africa-57443424,10 September 2021ShareSaveAdd as preferred on GoogleLucy FlemingBBC News,"Ethiopians are marking the start of a new year, with feasting in many homes despite the difficulties caused by rising prices and the war and hunger cr..."
8 Sep 2021,Rebels blamed for mass graves found in Ethiopia,The bodies of some 119 civilians are found by local officials - rebel forces deny responsibility.,https://static.files.bbci.co.uk/bbcdotcom/web/20260609-143108-fe43574f32-web-3.9.0-5/grey-placeholder.png,https://www.bbc.com/news/world-africa-58487928,8 September 2021ShareSaveAdd as preferred on Google,Ethiopian officials say they have found the graves of at least 119 civilians after rebel forces withdrew from a village they had occupied. Tigray's re...
7 Sep 2021,About 150 starve to death in Ethiopia - rebels,"There is a ""complete depletion of food stocks"" in the Ethiopian region of Tigray, the TPLF says.",https://static.files.bbci.co.uk/bbcdotcom/web/20260609-143108-fe43574f32-web-3.9.0-5/grey-placeholder.png,https://www.bbc.com/news/world-africa-58428711,7 September 2021ShareSaveAdd as preferred on Google,"About 150 people died of starvation in Ethiopia's war-hit Tigray region in August, the Tigray People's Liberation Front (TPLF) has said. These are the..."
5 Sep 2021,Thousands reported killed in Ethiopia clashes,Both the Tigray rebels and Ethiopian military say they have inflicted thousands of casualties.,https://static.files.bbci.co.uk/bbcdotcom/web/20260609-143108-fe43574f32-web-3.9.0-5/grey-placeholder.png,https://www.bbc.com/news/world-africa-58450223,5 September 2021ShareSaveAdd as preferred on Google,"Thousands have been reported killed in clashes in northern Ethiopia, as fighting between the military and Tigray rebels continues. The conflict has be..."
2 Sep 2021,Millions at risk under Ethiopia aid blockade - UN,"""The world's worst famine situation in decades"" is brewing in the north of the country, the UN says.",https://static.files.bbci.co.uk/bbcdotcom/web/20260609-143108-fe43574f32-web-3.9.0-5/grey-placeholder.png,https://www.bbc.com/news/world-africa-58420509,2 September 2021ShareSaveAdd as preferred on Google,"The lives of millions of Ethiopians in the north of the country are under threat as aid supplies are not reaching the conflict-hit area, the UN has sa..."
30 Aug 2021,Food prices soar as war ravages Ethiopia,"Food prices are rising, the currency's value is falling and investor confidence is shaken.",https://static.files.bbci.co.uk/bbcdotcom/web/20260609-143108-fe43574f32-web-3.9.0-5/grey-placeholder.png,https://www.bbc.com/news/world-africa-58319977,"30 August 2021ShareSaveAdd as preferred on GoogleVivienne NunisBBC News, Africa correspondent","Ethiopia's 10-month war has come at a huge human cost, with thousands killed, millions displaced and many in desperate need of assistance. But that's ..."
20 Aug 2021,US accuses Ethiopia of blocking aid to Tigray,"Washington's aid chief says food is set to run out, with hundreds of thousands at risk of famine.",https://static.files.bbci.co.uk/bbcdotcom/web/20260609-143108-fe43574f32-web-3.9.0-5/grey-placeholder.png,https://www.bbc.com/news/world-africa-58279442,20 August 2021ShareSaveAdd as preferred on Google,The US international development agency has blamed the Ethiopian government for a shortage of humanitarian aid in the country's conflict-torn Tigray r...
19 Aug 2021,Teenagers become pawns in Ethiopia propaganda war,"The BBC is told they were forced to fight for Tigray's rebels, but were words put into their mouths?",https://static.files.bbci.co.uk/bbcdotcom/web/20260609-143108-fe43574f32-web-3.9.0-5/grey-placeholder.png,https://www.bbc.com/news/world-africa-58189395,"19 August 2021ShareSaveAdd as preferred on GoogleVivienne NunisBBC News, Africa correspondent","The fog of war is a term usually used to describe confusion on the battlefield, but when it comes to Ethiopia, it could just as easily be applied to t..."
14 Aug 2021,Fact-checking claims about food aid for Tigray,Who's preventing desperately needed aid supplies reaching Ethiopia's Tigray region?,https://static.files.bbci.co.uk/bbcdotcom/web/20260609-143108-fe43574f32-web-3.9.0-5/grey-placeholder.png,https://www.bbc.com/news/58189049,14 August 2021ShareSaveAdd as preferred on GooglePeter MwaiBBC Reality Check,"With conflict continuing in Ethiopia's Tigray region and nearby areas, the government has made a series of claims about the problems in accessing much..."
11 Aug 2021,Ethiopia using rape as strategy of war - Amnesty,"Sexual violations during the conflict in Tigray amount to war crimes, the rights group says.",https://static.files.bbci.co.uk/bbcdotcom/web/20260609-143108-fe43574f32-web-3.9.0-5/grey-placeholder.png,https://www.bbc.com/news/world-africa-58167818,"11 August 2021ShareSaveAdd as preferred on GoogleVivienne NunisBBC News, Africa correspondent","The Ethiopian military and its allies are responsible for widespread sexual violence against women in Tigray, using rape as a strategy of war, Amnesty..."
10 Aug 2021,Ethiopian PM calls on civilians to join war effort,"Abiy Ahmed has asked all ""capable"" Ethiopians to join the fight against resurgent Tigrayan rebels.",https://static.files.bbci.co.uk/bbcdotcom/web/20260609-143108-fe43574f32-web-3.9.0-5/grey-placeholder.png,https://www.bbc.com/news/world-africa-58163641,10 August 2021ShareSaveAdd as preferred on Google,"Ethiopia's prime minister has called on civilians to join the army in its fight against rebels in the Tigray region. Abiy Ahmed asked ""all capable Eth..."
5 Aug 2021,Ethiopian rebels take Unesco world heritage town,"Forces from the Tigray region have taken control of Lalibela, home to famed rock-hewn churches.",https://static.files.bbci.co.uk/bbcdotcom/web/20260609-143108-fe43574f32-web-3.9.0-5/grey-placeholder.png,https://www.bbc.com/news/world-africa-58101912,5 August 2021ShareSaveAdd as preferred on Google,"Rebels from Ethiopia's northern Tigray region have taken control of the town of Lalibela, a Unesco world heritage site in neighbouring Amhara region. ..."
3 Aug 2021,Bodies wash up in Sudan-Ethiopia border river,"The corpses had gunshot wounds and hands tied behind their backs, a doctor tells the BBC.",https://static.files.bbci.co.uk/bbcdotcom/web/20260609-143108-fe43574f32-web-3.9.0-5/grey-placeholder.png,https://www.bbc.com/news/world-africa-58077642,"3 August 2021ShareSaveAdd as preferred on GoogleVivienne NunisBBC News, Africa correspondent","Bodies with gunshot wounds and hands tied behind their backs have washed up in a river in Sudan that borders Ethiopia, a doctor has told the BBC. Dr T..."
2 Aug 2021,Can Ethiopia be pulled back from the brink?,"The nine-month-long conflict in Tigray has spread, with little hope of peace talks taking place soon.",https://static.files.bbci.co.uk/bbcdotcom/web/20260609-143108-fe43574f32-web-3.9.0-5/grey-placeholder.png,https://www.bbc.com/news/world-africa-58051057,"2 August 2021ShareSaveAdd as preferred on GoogleVivienne NunisBBC News, Africa correspondent",There are increasing concerns about Ethiopian unity as the conflict in the northern Tigray region escalates. The nine-month-long war between Tigrayan ...
2 Aug 2021,Ethiopia rebels vow to fight until blockade ends,"Gen Tsadkan, who leads the rebel forces, tells the BBC they aim to reclaim lost territory.",https://static.files.bbci.co.uk/bbcdotcom/web/20260609-143108-fe43574f32-web-3.9.0-5/grey-placeholder.png,https://www.bbc.com/news/world-africa-58056588,2 August 2021ShareSaveAdd as preferred on Google,The commander of the rebel group in Ethiopia's northern region of Tigray has told the BBC they will continue fighting until their terms for a ceasefir...
29 Jul 2021,Fighting escalates in Ethiopia despite ceasefire,"Forces in Amhara are battling rebels on three fronts along the border with Tigray, officials say.",https://static.files.bbci.co.uk/bbcdotcom/web/20260609-143108-fe43574f32-web-3.9.0-5/grey-placeholder.png,https://www.bbc.com/news/world-africa-58013100,29 July 2021ShareSaveAdd as preferred on Google,Intense fighting is being reported in Ethiopia's Amhara state - the latest sign that the war that erupted in the Tigray region in November is spreadin...
26 Jul 2021,First Ethiopian winner of Caine Prize 'in shock',"Judges praised Meron Hadero's short story The Street Sweep which ends in a ""clever twist"".",https://static.files.bbci.co.uk/bbcdotcom/web/20260609-143108-fe43574f32-web-3.9.0-5/grey-placeholder.png,https://www.bbc.com/news/world-africa-57975088,26 July 2021ShareSaveAdd as preferred on Google,"Meron Hadero has become the first Ethiopian author to win the prestigious AKO Caine Prize for African Writing. ""I'm absolutely thrilled, I'm in shock ..."
22 Jul 2021,New front opens in Ethiopia war as aid fears grow,A bloody eight-month battle for control of the Tigray region spills over into neighbouring Afar.,https://static.files.bbci.co.uk/bbcdotcom/web/20260609-143108-fe43574f32-web-3.9.0-5/grey-placeholder.png,https://www.bbc.com/news/world-africa-57926832,"22 July 2021ShareSaveAdd as preferred on GoogleVivienne NunisBBC News, Africa correspondent",A bloody eight-month battle for control of the north Ethiopian state of Tigray has spilled over into the neighbouring region of Afar in the past week....
