Date,Title,Description,Banner,Article Link,Author,Content
1 Jun 2026,Voting suspended in parts of Ethiopia over security concerns ,Prime Minister Abiy Ahmed's party is expected to dominate the election as conflicts overshadow the vote.,https://static.files.bbci.co.uk/bbcdotcom/web/20260609-143108-fe43574f32-web-3.9.0-5/grey-placeholder.png,https://www.bbc.com/news/articles/cn0pngz2rego,1 June 2026ShareSaveAdd as preferred on GoogleKaleb MogesBBC Africa,"Voting in Monday's general election was suspended in parts of Ethiopia's Oromia and Amhara regions due to security concerns, but long voter queues wer..."
31 May 2026,I moved from Ethiopia to Shetland - and I've brought the coffee with me,"Netsanet Sori is bringing a flavour of the farm where she grew up to her new home 4,000 miles away.",https://static.files.bbci.co.uk/bbcdotcom/web/20260609-143108-fe43574f32-web-3.9.0-5/grey-placeholder.png,https://www.bbc.com/news/articles/cvgz46znz0vo,31 May 2026ShareSaveAdd as preferred on GoogleIona NicolBBC Scotland News,"Shetland has plenty of honesty boxes - filled with fresh eggs, home baking and even pies. However, the 1,000 or so residents on the island of Whalsay ..."
8 May 2026,Ethiopian woman's joy at rare quintuplets after 12 years trying for a baby,"The woman, 35, says she was praying for a baby and was ""overjoyed"" to be ""blessed with five at once"".",https://static.files.bbci.co.uk/bbcdotcom/web/20260609-143108-fe43574f32-web-3.9.0-5/grey-placeholder.png,https://www.bbc.com/news/articles/c893y34zlv0o,8 May 2026ShareSaveAdd as preferred on GoogleMichael TeferiBBC Africa,A woman has given birth to rare quintuplets in Ethiopia's Harari Regional state after 12 years of trying for a baby. Bedriya Adem said she and her hus...
18 Apr 2026,Millions listen to Ethiopian star's song taking swipe at government,The country's biggest musician Teddy Afro laments a lack of unity in the country on his new track.,https://static.files.bbci.co.uk/bbcdotcom/web/20260609-143108-fe43574f32-web-3.9.0-5/grey-placeholder.png,https://www.bbc.com/news/articles/cqj81g5dxkyo,18 April 2026ShareSaveAdd as preferred on GoogleBBC Amharic,"In a country where criticising the authorities has often landed people in trouble, the latest song from Ethiopia's biggest musician – which appears to..."
7 Apr 2026,Ringleader of suspected human trafficking network arrested in Ethiopia,"Yetbarek Dawit is alleged to have operated a multi-million-dollar operation, using torture to raise money.",https://static.files.bbci.co.uk/bbcdotcom/web/20260609-143108-fe43574f32-web-3.9.0-5/grey-placeholder.png,https://www.bbc.com/news/articles/cn08gx8k5ego,7 April 2026ShareSaveAdd as preferred on GoogleKaleb MogesBBC Africa,Police in Ethiopia have arrested a man accused of being at the centre of a multi-million-dollar international human trafficking ring that since 2018 h...
30 Mar 2026,Rationing power and diluting petrol - how African countries are coping with effects of Iran war,The disruption in oil supplies has caused shortages and concerns in several African countries.,https://static.files.bbci.co.uk/bbcdotcom/web/20260609-143108-fe43574f32-web-3.9.0-5/grey-placeholder.png,https://www.bbc.com/news/articles/cq8wkq1n9epo,"30 March 2026ShareSaveAdd as preferred on GoogleBasillioh Rukanga,Nairobi,Shingai Nyoka,Harare,Hafsa KhalilandMakuochi Okafor,Lagos",Countries across Africa have taken measures such as diluting petrol and restricting electricity consumption to cope with the fuel crisis triggered by ...
28 Mar 2026,Shops and restaurants in Egypt told to close early as energy crisis deepens,Retail and dining premises will have to shut by 21:00 each night for the next month to conserve power.,https://static.files.bbci.co.uk/bbcdotcom/web/20260609-143108-fe43574f32-web-3.9.0-5/grey-placeholder.png,https://www.bbc.com/news/articles/c0rxz7ggv8go,28 March 2026ShareSaveAdd as preferred on GoogleAleks Phillips,"Shops, restaurants and cafes in Egypt have been told to close early as part of a raft of temporary measures to combat soaring energy prices caused by ..."
12 Mar 2026,Death toll from Ethiopia floods and landslides rises to more than 100,"Forecasters say storms are becoming more intense in the region, partly due to global warming.",https://static.files.bbci.co.uk/bbcdotcom/web/20260609-143108-fe43574f32-web-3.9.0-5/grey-placeholder.png,https://www.bbc.com/news/articles/ce947x4m0e1o,12 March 2026ShareSaveAdd as preferred on GoogleMichael TeferiBBC Africa,"At least 102 people have been killed in floods and landslides triggered by heavy rains in the Gamo Zone of southern Ethiopia, the local authority has ..."
6 Mar 2026,The young women who fought in Ethiopia's last civil war and don't want to see another one,"Female fighters recall how the conflict in the northern Tigray destroyed their lives, as fears grow that fighting could resume.",https://static.files.bbci.co.uk/bbcdotcom/web/20260609-143108-fe43574f32-web-3.9.0-5/grey-placeholder.png,https://www.bbc.com/news/articles/cyv959eyjgjo,6 March 2026ShareSaveAdd as preferred on GoogleHana ZeratsyonBBC Tigrinya,Twenty-two-year-old Abeba Amdu has seen some of the best years of her life consumed by war - and she has no wish to see another conflict in Ethiopia's...
5 Mar 2026,Ethiopia experiments with 'smart' police stations that have no officers,A project to introduce unmanned sites is part of a broader adoption of digital technologies.,https://static.files.bbci.co.uk/bbcdotcom/web/20260609-143108-fe43574f32-web-3.9.0-5/grey-placeholder.png,https://www.bbc.com/news/articles/cjd9jgnrdpko,"5 March 2026ShareSaveAdd as preferred on GoogleDaniel DadzieBBC Focus on Africa, Addis Ababa",Computer tablet screens glow inside a row of partitioned booths at a new-style Ethiopian police station. There is no commotion. There is no front desk...
5 Mar 2026,Inside Ethiopia's 'smart' police station,"Ethiopia unveils its first unmanned, 'smart' police station where citizens can report crimes on automated touch screens.",https://static.files.bbci.co.uk/bbcdotcom/web/20260609-143108-fe43574f32-web-3.9.0-5/grey-placeholder.png,https://www.bbc.com/news/videos/cz9qqzqkk82o,Unknown,No content found
26 Feb 2026,Is Ethiopia heading back to war in Tigray?,Many people are again leaving the region of Tigray just over three years after the civil war there ended.,https://static.files.bbci.co.uk/bbcdotcom/web/20260609-143108-fe43574f32-web-3.9.0-5/grey-placeholder.png,https://www.bbc.com/news/articles/cwygrnjz9wro,26 February 2026ShareSaveAdd as preferred on GoogleKalkidan Yibeltal,Fears of a return to war in northern Ethiopia are driving many people to leave the region of Tigray just over three years after the civil war there en...
18 Feb 2026,Turkey's president rejects Israel's recognition of Somaliland,"He made the comment on an official visit to Ethiopia, saying it could prove dangerous for a volatile region.",https://static.files.bbci.co.uk/bbcdotcom/web/20260609-143108-fe43574f32-web-3.9.0-5/grey-placeholder.png,https://www.bbc.com/news/articles/c0lj0plkg09o,18 February 2026ShareSaveAdd as preferred on GoogleMichael TeferiBBC Africa,Turkey's President Recep Tayyip Erdogan has rejected Israel's recognition of the breakaway region of Somaliland as an independent nation. During a vis...
9 Feb 2026,Eritrea accuses Ethiopia of fabricating report its troops had crossed the border,Ethiopia had alleged that Eritrean soldiers were on its territory and supporting rebels in the north.,https://static.files.bbci.co.uk/bbcdotcom/web/20260609-143108-fe43574f32-web-3.9.0-5/grey-placeholder.png,https://www.bbc.com/news/articles/cn87lzrj1l7o,9 February 2026ShareSaveAdd as preferred on GoogleDamian Zane,"Eritrea has hit back at its neighbour Ethiopia describing accusations that its troops were on Ethiopian territory as ""false"". On Saturday, a letter se..."
3 Feb 2026,Ethiopia PM hits out at Eritrea over atrocities in Tigray,Abiy Ahmed admitted for the first time in parliament that Eritrean troops had killed people in Aksum.,https://static.files.bbci.co.uk/bbcdotcom/web/20260609-143108-fe43574f32-web-3.9.0-5/grey-placeholder.png,https://www.bbc.com/news/articles/c74vpdnj301o,3 February 2026ShareSaveAdd as preferred on GoogleMichael TeferiBBC Africa,"Ethiopia's Prime Minister Abiy Ahmed has hit out at Eritrea's army for committing atrocities during the two-year war in the northern Tigray region, wh..."
29 Jan 2026,Flights to northern Ethiopia cancelled as fears mount of renewed conflict,"Passengers received a text message about the cancellation of flights, citing ""unforeseen circumstances"".",https://static.files.bbci.co.uk/bbcdotcom/web/20260609-143108-fe43574f32-web-3.9.0-5/grey-placeholder.png,https://www.bbc.com/news/articles/cn40r3v770lo,29 January 2026ShareSaveAdd as preferred on GoogleMichael TeferiBBC Africa,"Passenger flights between Ethiopia's capital, Addis Ababa, and cities in the northern Tigray region have been cancelled amid fears of a return to conf..."
19 Jan 2026,"Drums, chants and celebrations as Ethiopians mark the baptism of Jesus","The Ethiopian Orthodox festival of Timket, or Epiphany, commemorates the baptism of Jesus in the Jordan.",https://static.files.bbci.co.uk/bbcdotcom/web/20260609-143108-fe43574f32-web-3.9.0-5/grey-placeholder.png,https://www.bbc.com/news/articles/cr4k3p6x1q5o,19 January 2026ShareSaveAdd as preferred on GoogleDamian Zane,"Ethiopian Orthodox Christians have been celebrating the festival of Timket, or Epiphany, which commemorates the baptism of Jesus in the River Jordan. ..."
18 Jan 2026,'I want to show the world what Africa is': YouTube star brings joy and tears on tour,"""I love the love in Africa. The energy here is crazy,"" he says on his maiden tour of the continent.",https://static.files.bbci.co.uk/bbcdotcom/web/20260609-143108-fe43574f32-web-3.9.0-5/grey-placeholder.png,https://www.bbc.com/news/articles/c5y5le7yl7po,18 January 2026ShareSaveAdd as preferred on GooglePenny Dale,"One of the world's most popular content creators has been attracting huge crowds, mostly his young fans, as he undertakes a 20-nation tour of Africa, ..."
15 Jan 2026,Ethiopia says seized ammunition sent by Eritrea to rebels as tensions rise,"Eritrea denies the claim and accuses Ethiopia of seeking a pretext to attack, amid fears of renewed conflict.",https://static.files.bbci.co.uk/bbcdotcom/web/20260609-143108-fe43574f32-web-3.9.0-5/grey-placeholder.png,https://www.bbc.com/news/articles/czr46ypzl4yo,15 January 2026ShareSaveAdd as preferred on GoogleEmily Atkinson,"Ethiopian police say they have seized thousands of rounds of ammunition sent by Eritrea to a violent armed rebel group, stoking fears of renewed confl..."
6 Jan 2026,At least 22 Ethiopian migrants killed in 'horrific' road crash,"About 85 Ethiopian migrants were trying to leave the country when the accident occurred, authorities say.",https://static.files.bbci.co.uk/bbcdotcom/web/20260609-143108-fe43574f32-web-3.9.0-5/grey-placeholder.png,https://www.bbc.com/news/articles/cn82g8wwvn5o,6 January 2026ShareSaveAdd as preferred on GoogleMichael Teferi,"At least 22 migrants have been killed and 65 others injured after a lorry they were travelling in overturned in Ethiopia's north-eastern Afar region, ..."
28 Dec 2025,Godfather of Ethiopian jazz on his farewell tour,Mulatu Astatke has been blending jazz influences from home and abroad for the past six decades.,https://static.files.bbci.co.uk/bbcdotcom/web/20260609-143108-fe43574f32-web-3.9.0-5/grey-placeholder.png,https://www.bbc.com/news/articles/cy073xp2yj0o,28 December 2025ShareSaveAdd as preferred on GoogleMarta PausilliBBC Africa,"Ethiopian jazz musician Mulatu Astatke smiled as he held his arms aloft to acknowledge his audience. Last month in London, the 82-year-old pioneer, wh..."
12 Dec 2025,Eritrea quits regional bloc as tensions rise with Ethiopia,Eritrea says it has been targetted by Igad and that the bloc is failing its founding principles.,https://static.files.bbci.co.uk/bbcdotcom/web/20260609-143108-fe43574f32-web-3.9.0-5/grey-placeholder.png,https://www.bbc.com/news/articles/cly555k8de3o,"12 December 2025ShareSaveAdd as preferred on GoogleTesfalem Araia,BBC TigrinyaandHanna Temuari,BBC Africa, Addis Ababa","Eritrea has withdrawn from East African regional bloc Igad, accusing the organisation of ""becoming a tool against"" countries like itself. In a stateme..."
12 Dec 2025,Ethiopia arrests nine TikTok creators in social media crackdown,"Six popular creators were detained over allegations of wearing ""indecent attire"" at a public event.",https://static.files.bbci.co.uk/bbcdotcom/web/20260609-143108-fe43574f32-web-3.9.0-5/grey-placeholder.png,https://www.bbc.com/news/articles/c23e1jld9p7o,"12 December 2025ShareSaveAdd as preferred on GoogleHanna Temuari,BBC Africa, Addis Ababa,Girmay Gebru,BBC Tigrinya, MekelleandAmeyu Etana,BBC Afaan Oromoo",Ethiopian police have arrested nine TikTok content creators this week for allegedly violating norms in the culturally conservative country. Six of the...
25 Nov 2025,'My mum has been refused visa to attend Christening',"Tutu Melaku says it is an ""injustice"" that her mother is denied travel from Ethiopia for the event.",https://static.files.bbci.co.uk/bbcdotcom/web/20260609-143108-fe43574f32-web-3.9.0-5/grey-placeholder.png,https://www.bbc.com/news/articles/ckgl0z862rjo,25 November 2025ShareSaveAdd as preferred on GoogleRich ClarkeBBC Radio Berkshire,"A British woman has said it is an ""injustice"" that her elderly mother will not be able to attend her great-granddaughter's Christening after she was d..."
25 Nov 2025,"Ethiopian volcano eruption sends ash to Delhi, hitting flight operations","India’s aviation regulator has asked airline operators to “strictly avoid"" volcanic ash affected areas. ",https://static.files.bbci.co.uk/bbcdotcom/web/20260609-143108-fe43574f32-web-3.9.0-5/grey-placeholder.png,https://www.bbc.com/news/articles/cn41vl9d5qko,25 November 2025ShareSaveAdd as preferred on GoogleAbhishek Dey,"A plume of volcanic ash from Ethiopia has swept across the Red Sea through Oman and Yemen and reached Delhi, the India Meteorological Department (IMD)..."
23 Nov 2025,Escalating war of words between Ethiopia and Eritrea triggers fears of conflict,The authorities in landlocked Ethiopia have ratcheted up rhetoric over access to an Eritrean port. ,https://static.files.bbci.co.uk/bbcdotcom/web/20260609-143108-fe43574f32-web-3.9.0-5/grey-placeholder.png,https://www.bbc.com/news/articles/cvgwg042vr4o,23 November 2025ShareSaveAdd as preferred on GoogleBBC Monitoring,"There are growing concerns over the possibility of armed conflict between Horn of Africa neighbours, Ethiopia and Eritrea, as hostile rhetoric has rat..."
20 Nov 2025,Ethiopia receives historic artefacts held in Germany for 100 years ,Ethiopia has welcomed the return as part of a broader push to repatriate items of national significance.,https://static.files.bbci.co.uk/bbcdotcom/web/20260609-143108-fe43574f32-web-3.9.0-5/grey-placeholder.png,https://www.bbc.com/news/articles/c07m7pl3njmo,20 November 2025ShareSaveAdd as preferred on GoogleWycliffe Muia,"Twelve historical artefacts have been formally returned to Ethiopia after being kept by a German family for more than 100 years. The artefacts, origin..."
19 Nov 2025,'It would have been better if they'd killed me': A forgotten war destroying women's lives,"Thousands of women have been raped in Ethiopia’s Amhara conflict, BBC Global Women finds.",https://static.files.bbci.co.uk/bbcdotcom/web/20260609-143108-fe43574f32-web-3.9.0-5/grey-placeholder.png,https://www.bbc.com/news/articles/cx2p8dpw1rwo,19 November 2025ShareSaveAdd as preferred on GoogleBBC World Service,Warning: This report contains descriptions of rape and sexual violence. Names of victims have been changed and identifying details omitted to protect ...
29 Oct 2025,Migrant sex offender given £500 after threat to disrupt deportation,"Hadush Kebatu was given the money to avoid a ""slower, more expensive process"", Downing Street said. ",https://static.files.bbci.co.uk/bbcdotcom/web/20260609-143108-fe43574f32-web-3.9.0-5/grey-placeholder.png,https://www.bbc.com/news/articles/cly9rxlvp85o,"29 October 2025ShareSaveAdd as preferred on GoogleDaniel Sandford,UK correspondentandMaia Davies",A migrant sex offender mistakenly released from prison was given a £500 payment after threatening to disrupt his deportation from the UK to Ethiopia. ...
21 Oct 2025,Passengers jump from windows in fatal Ethiopia train crash,"Fifteen people died in the night-time collision in the Somali region, officials tell the BBC.",https://static.files.bbci.co.uk/bbcdotcom/web/20260609-143108-fe43574f32-web-3.9.0-5/grey-placeholder.png,https://www.bbc.com/news/articles/clyl2gg2zx4o,"21 October 2025ShareSaveAdd as preferred on GoogleSahnun AhmedandAbdishukri Haybe,BBC Somali","Passengers were forced to jump from carriages in a train crash that killed 15 people in eastern Ethiopia, a local official has told the BBC. The train..."
15 Oct 2025,How many wars has President Trump really ended?,US President Donald Trump claims to have ended eight wars - is that true?,https://static.files.bbci.co.uk/bbcdotcom/web/20260609-143108-fe43574f32-web-3.9.0-5/grey-placeholder.png,https://www.bbc.com/news/articles/c5y3599gx4qo,15 October 2025ShareSaveAdd as preferred on GoogleJake Horton & Nick BeakeBBC Verify,"President Trump has claimed that he has ""ended 8 wars in just 8 months"" in a social media post with the title ""the president of peace"". His latest add..."
9 Oct 2025,Ethiopia accuses Eritrea of preparing for war as Red Sea tensions rise,"Ethiopia has written to the UN, accusing Eritrea of ""funding, mobilizing and directing armed groups"" on its soil.",https://static.files.bbci.co.uk/bbcdotcom/web/20260609-143108-fe43574f32-web-3.9.0-5/grey-placeholder.png,https://www.bbc.com/news/articles/cyv6r6e6800o,"9 October 2025ShareSaveAdd as preferred on GoogleTeklemariam Bekit,Editor, BBC TigrinyaandYemane Nagish,BBC Tigrinya","Ethiopia has accused Eritrea of preparing to wage war against it in collusion with an  opposition grouping, in the latest sign of escalating tensions ..."
6 Oct 2025,Selfies and singing as Ethiopians celebrate thanksgiving,Photos capture the joy and unity present at this year's Irreecha festival.,https://static.files.bbci.co.uk/bbcdotcom/web/20260609-143108-fe43574f32-web-3.9.0-5/grey-placeholder.png,https://www.bbc.com/news/articles/cd6399enj39o,"6 October 2025ShareSaveAdd as preferred on GoogleAmensisa IfaBBC Africa, Addis Ababa & Bishoftu ",Tens of thousands of vibrantly dressed Ethiopians descended on downtown Addis Ababa for an annual thanksgiving festival this weekend. Irreecha is cele...
2 Oct 2025,"Scaffolding collapsed as people climbed to see Ethiopia church mural, eyewitness tells BBC",Funerals are held for 36 people who died after scaffolding collapsed at an Orthodox Christian church.,https://static.files.bbci.co.uk/bbcdotcom/web/20260609-143108-fe43574f32-web-3.9.0-5/grey-placeholder.png,https://www.bbc.com/news/articles/cly6en6l141o,"2 October 2025ShareSaveAdd as preferred on GoogleAmensisa Ifa,BBC Africa, ArertiandSammy Awami,BBC Africa, Nairobi","A day after the joyous celebration of a religious festival, mass funerals  were held in the small Ethiopian town of Arerti for the 36 people killed wh..."
1 Oct 2025,At least 30 die after Ethiopia church scaffolding falls,Worshippers had gathered at the Arerti Mariam church early in the morning for the annual St Mary celebration.,https://static.files.bbci.co.uk/bbcdotcom/web/20260609-143108-fe43574f32-web-3.9.0-5/grey-placeholder.png,https://www.bbc.com/news/articles/cly9p9p6lz0o,1 October 2025ShareSaveAdd as preferred on GoogleBBC Amharic,At least 30 people have died and more than 200 others been injured after scaffolding collapsed at a church in Ethiopia. Thousands of worshippers were ...
24 Sep 2025,Somalia's president: They tried to kill me five times,Somalia's President Hassan Sheikh Mohamud says he is a prime target of the Islamist group al-Shabab. ,https://static.files.bbci.co.uk/bbcdotcom/web/20260609-143108-fe43574f32-web-3.9.0-5/grey-placeholder.png,https://www.bbc.com/news/videos/cx23e9d5wjgo,Unknown,No content found
11 Sep 2025,Party like it's 2018 - Ethiopians celebrate their new year,Photos of new year celebrations in a country with a calendar seven years behind that followed in the West.,https://static.files.bbci.co.uk/bbcdotcom/web/20260609-143108-fe43574f32-web-3.9.0-5/grey-placeholder.png,https://www.bbc.com/news/articles/c4g2z8nv344o,"11 September 2025ShareSaveAdd as preferred on GoogleAmensisa IfaBBC Africa, Addis Ababa","Ethiopia is celebrating the start of its new year - 2018. The country has its own unique calendar, meaning it is seven years behind the Western calend..."
9 Sep 2025,The pride of Ethiopia - What it took to build Africa's largest hydro-electric dam,"In a fractious nation, the dam's construction has brought people together despite controversy abroad.",https://static.files.bbci.co.uk/bbcdotcom/web/20260609-143108-fe43574f32-web-3.9.0-5/grey-placeholder.png,https://www.bbc.com/news/articles/cr4qx6377qgo,9 September 2025ShareSaveAdd as preferred on GoogleKalkidan YibeltalBBC News in Addis Ababa,The vastness of the building site was at first overwhelming for the young Ethiopian mechanical engineer. Hundreds were already digging the foundations...
7 Sep 2025,Ethiopia outfoxes Egypt over the Nile's waters with its mighty dam,Ethiopia is set to inaugurate a mega dam that has stoked tensions with Egypt.,https://static.files.bbci.co.uk/bbcdotcom/web/20260609-143108-fe43574f32-web-3.9.0-5/grey-placeholder.png,https://www.bbc.com/news/articles/cz71zndj001o,7 September 2025ShareSaveAdd as preferred on GoogleFarouk Chothia & Yemane NagishBBC News & BBC Tigrinya,"After outfoxing Egypt on the diplomatic stage for more than a decade, Ethiopia is set to officially inaugurate one of the world's biggest dams on a tr..."
24 Aug 2025,How Russia is quietly trying to win over the world beyond the West,"Over the past three years, Russian state-backed news channel RT has expanded its international presence.",https://static.files.bbci.co.uk/bbcdotcom/web/20260609-143108-fe43574f32-web-3.9.0-5/grey-placeholder.png,https://www.bbc.com/news/articles/cm2vr37yd4no,"24 August 2025ShareSaveAdd as preferred on GoogleJuliana Gragnani,Editor, BBC Global Disinformation UnitandMaria Korenyuk,BBC Global Disinformation Unit",Listen to Juliana read this article Javier Gallardo likes to start his morning watching a classical music programme on television - it is part of his ...
4 Aug 2025,Dozens of migrants die in boat capsize off Yemen,"Dozens are missing after a boat carrying more than 150 migrants, many believed to be Ethiopian, sank in bad weather.",https://static.files.bbci.co.uk/bbcdotcom/web/20260609-143108-fe43574f32-web-3.9.0-5/grey-placeholder.png,https://www.bbc.com/news/articles/cn84rrmlxvxo,4 August 2025ShareSaveAdd as preferred on GoogleYang TianBBC News,At least 68 migrants have died after a boat with about 157 people on board sank off the coast of Yemen in bad weather. The vessel capsized off the sou...
23 Jul 2025,Ethiopian official denies Donald Trump's claim that US funded River Nile dam,"Ethiopia has repeatedly said the megadam, a major source of pride in the country, was totally self-funded.",https://static.files.bbci.co.uk/bbcdotcom/web/20260609-143108-fe43574f32-web-3.9.0-5/grey-placeholder.png,https://www.bbc.com/news/articles/c89e41z388qo,"23 July 2025ShareSaveAdd as preferred on GoogleWedaeli Chibelushi,BBC NewsandKalkidan Yibeltal,BBC News in Addis Ababa","An Ethiopian official has denied Donald Trump's claim that the United States helped fund Ethiopia's new megadam on the River Nile, saying it is false ..."
15 Jul 2025,"Aid workers 'executed' in Ethiopia's Tigray war, charity says","A Spaniard and two Ethiopians were shot dead during the conflict in northern Ethiopia, MSF says.",https://static.files.bbci.co.uk/bbcdotcom/web/20260609-143108-fe43574f32-web-3.9.0-5/grey-placeholder.png,https://www.bbc.com/news/articles/c8j1ve1w878o,"15 July 2025ShareSaveAdd as preferred on GoogleAnne SoyBBC deputy Africa editor, Nairobi","An investigation by medical charity Médecins Sans Frontières (MSF) into the ""execution"" of three of its workers during a humanitarian mission in Ethio..."
12 Jul 2025,Live Aid volunteer sat behind Diana at Wembley ,"Dee Flower, from Bexhill, is a guest at a gala on Sunday to mark the 40th anniversary of Live Aid. ",https://static.files.bbci.co.uk/bbcdotcom/web/20260609-143108-fe43574f32-web-3.9.0-5/grey-placeholder.png,https://www.bbc.com/news/articles/cqjqgjdvzqxo,"12 July 2025ShareSaveAdd as preferred on GoogleStuart MaisnerBBC News, South East",A volunteer who helped Bob Geldof organise lorries to take charity aid to Africa has been reminiscing about how she sat in the royal box for the Live ...
11 Jul 2025,US cuts visa validity for applicants from four African countries,"The United States cuts the length of its visas for citizens of Cameroon, Ethiopia, Ghana and Nigeria.",https://static.files.bbci.co.uk/bbcdotcom/web/20260609-143108-fe43574f32-web-3.9.0-5/grey-placeholder.png,https://www.bbc.com/news/articles/cx23ywg9w82o,"11 July 2025ShareSaveAdd as preferred on GoogleChiamaka Enendu & Mansur AbubakarBBC News, Lagos & Abuja","The United States has announced sweeping changes to its non-immigrant visa policy for Cameroon, Ethiopia, Ghana and Nigeria, cutting the duration and ..."
